{
  "v": "1.0.0",
  "generated": "2026-09-19T14:13:06.912351+00:00",
  "fingerprint": {
    "version": "1.0.0",
    "sources": [
      "icons_v1.yaml",
      "nutrition_v1.yaml",
      "icons_v1_usage.yaml",
      "vessel_tpl.yaml",
      "opts_tpl.yaml"
    ],
    "count": 347,
    "generatedAt": "2026-09-19T14:13:06.912351+00:00"
  },
  "vesselTpl": {
    "cup": {
      "label": "杯",
      "sizes": [
        {
          "k": "s",
          "name": "小杯",
          "amount": 350,
          "unit": "ml"
        },
        {
          "k": "m",
          "name": "中杯",
          "amount": 500,
          "unit": "ml"
        },
        {
          "k": "l",
          "name": "大杯",
          "amount": 700,
          "unit": "ml"
        }
      ]
    },
    "cup_coffee": {
      "label": "杯",
      "sizes": [
        {
          "k": "m",
          "name": "中杯",
          "amount": 355,
          "unit": "ml"
        },
        {
          "k": "l",
          "name": "大杯",
          "amount": 473,
          "unit": "ml"
        }
      ]
    },
    "cup_soda": {
      "label": "杯",
      "sizes": [
        {
          "k": "s",
          "name": "小杯",
          "amount": 330,
          "unit": "ml"
        },
        {
          "k": "m",
          "name": "中杯",
          "amount": 500,
          "unit": "ml"
        },
        {
          "k": "l",
          "name": "大杯",
          "amount": 700,
          "unit": "ml"
        }
      ]
    },
    "mug": {
      "label": "杯",
      "sizes": [
        {
          "k": "mug",
          "name": "一杯",
          "amount": 300,
          "unit": "ml"
        }
      ]
    },
    "glass": {
      "label": "杯",
      "sizes": [
        {
          "k": "glass",
          "name": "一杯",
          "amount": 250,
          "unit": "ml"
        }
      ]
    },
    "glass_wine": {
      "label": "杯",
      "sizes": [
        {
          "k": "glass",
          "name": "一杯",
          "amount": 150,
          "unit": "ml"
        }
      ]
    },
    "shot": {
      "label": "杯",
      "sizes": [
        {
          "k": "shot",
          "name": "一小杯",
          "amount": 50,
          "unit": "ml"
        }
      ]
    },
    "bottle": {
      "label": "瓶",
      "sizes": [
        {
          "k": "s",
          "name": "小瓶",
          "amount": 330,
          "unit": "ml"
        },
        {
          "k": "l",
          "name": "大瓶",
          "amount": 550,
          "unit": "ml"
        }
      ]
    },
    "can": {
      "label": "罐",
      "sizes": [
        {
          "k": "can",
          "name": "一罐",
          "amount": 330,
          "unit": "ml"
        }
      ]
    },
    "bowl_rice": {
      "label": "碗",
      "sizes": [
        {
          "k": "s",
          "name": "小碗",
          "amount": 150,
          "unit": "g"
        },
        {
          "k": "m",
          "name": "中碗",
          "amount": 200,
          "unit": "g"
        },
        {
          "k": "l",
          "name": "大碗",
          "amount": 300,
          "unit": "g"
        }
      ]
    },
    "bowl_noodle": {
      "label": "碗",
      "sizes": [
        {
          "k": "s",
          "name": "小碗",
          "amount": 250,
          "unit": "g"
        },
        {
          "k": "l",
          "name": "大碗",
          "amount": 400,
          "unit": "g"
        }
      ]
    },
    "bowl_soup": {
      "label": "碗",
      "sizes": [
        {
          "k": "bowl",
          "name": "一碗",
          "amount": 250,
          "unit": "g"
        }
      ]
    },
    "pot": {
      "label": "份",
      "sizes": [
        {
          "k": "s",
          "name": "小份",
          "amount": 400,
          "unit": "g"
        },
        {
          "k": "m",
          "name": "一份",
          "amount": 700,
          "unit": "g"
        },
        {
          "k": "l",
          "name": "大份",
          "amount": 1000,
          "unit": "g"
        }
      ]
    },
    "plate": {
      "label": "份",
      "sizes": [
        {
          "k": "half",
          "name": "半份",
          "amount": 100,
          "unit": "g"
        },
        {
          "k": "one",
          "name": "一份",
          "amount": 200,
          "unit": "g"
        },
        {
          "k": "two",
          "name": "两份",
          "amount": 400,
          "unit": "g"
        }
      ]
    },
    "piece": {
      "label": "个",
      "sizes": [
        {
          "k": "one",
          "name": "1个",
          "amount": 1,
          "unit": "个"
        }
      ]
    },
    "slice": {
      "label": "片",
      "sizes": [
        {
          "k": "one",
          "name": "1片",
          "amount": 1,
          "unit": "片"
        }
      ]
    },
    "skewer": {
      "label": "串",
      "sizes": [
        {
          "k": "one",
          "name": "1串",
          "amount": 1,
          "unit": "串"
        }
      ]
    },
    "bag": {
      "label": "包",
      "sizes": [
        {
          "k": "s",
          "name": "小包",
          "amount": 50,
          "unit": "g"
        },
        {
          "k": "l",
          "name": "大包",
          "amount": 100,
          "unit": "g"
        }
      ]
    }
  },
  "optTpl": {
    "sweet": {
      "key": "sweet",
      "label": "甜度",
      "def": "full",
      "type": "single",
      "scale": "by_capacity",
      "base_amount": 500,
      "base_unit": "ml",
      "hint": "甜度为估算值，各品牌糖量标准不同",
      "opts": [
        {
          "k": "none",
          "name": "无糖",
          "delta_kcal": 0,
          "estimate": false
        },
        {
          "k": "light",
          "name": "三分",
          "delta_kcal": 30,
          "estimate": true
        },
        {
          "k": "half",
          "name": "五分",
          "delta_kcal": 55,
          "estimate": true
        },
        {
          "k": "less",
          "name": "七分",
          "delta_kcal": 80,
          "estimate": true
        },
        {
          "k": "full",
          "name": "全糖",
          "delta_kcal": 110,
          "estimate": true
        }
      ]
    },
    "topping": {
      "key": "topping",
      "label": "加料",
      "def": [],
      "type": "multi",
      "scale": "none",
      "hint": "加料热量为量级估算，各品牌分量差异大",
      "opts": [
        {
          "k": "pearl",
          "name": "珍珠",
          "delta_kcal": 120,
          "estimate": true
        },
        {
          "k": "coconut",
          "name": "椰果",
          "delta_kcal": 60,
          "estimate": true
        },
        {
          "k": "taro",
          "name": "芋泥",
          "delta_kcal": 150,
          "estimate": true
        },
        {
          "k": "cheese",
          "name": "奶盖",
          "delta_kcal": 180,
          "estimate": true
        },
        {
          "k": "pudding",
          "name": "布丁",
          "delta_kcal": 100,
          "estimate": true
        }
      ]
    },
    "sugar_pack": {
      "key": "sugar_pack",
      "label": "加糖",
      "def": "zero",
      "type": "single",
      "scale": "none",
      "hint": "按白砂糖包计，1 包约 4g",
      "opts": [
        {
          "k": "zero",
          "name": "不加糖",
          "delta_kcal": 0,
          "estimate": false
        },
        {
          "k": "one",
          "name": "1包",
          "delta_kcal": 16,
          "estimate": true
        },
        {
          "k": "two",
          "name": "2包",
          "delta_kcal": 32,
          "estimate": true
        }
      ]
    },
    "syrup_pump": {
      "key": "syrup_pump",
      "label": "糖浆",
      "def": "zero",
      "type": "single",
      "scale": "none",
      "hint": "风味糖浆按泵计，1 泵约 5ml",
      "opts": [
        {
          "k": "zero",
          "name": "不加",
          "delta_kcal": 0,
          "estimate": false
        },
        {
          "k": "one",
          "name": "1泵",
          "delta_kcal": 20,
          "estimate": true
        },
        {
          "k": "two",
          "name": "2泵",
          "delta_kcal": 40,
          "estimate": true
        },
        {
          "k": "three",
          "name": "3泵",
          "delta_kcal": 60,
          "estimate": true
        }
      ]
    }
  },
  "foods": [
    {
      "id": "p001",
      "name": "米饭",
      "cat": "主食",
      "base": {
        "cal": 116,
        "per": 100,
        "unit": "g",
        "protein": 2.6,
        "carb": 25.9,
        "fat": 0.3
      },
      "pieceWeight": null,
      "vessel": "bowl_rice",
      "opts": [],
      "img": "staple/p001.webp",
      "conf": 3,
      "editable": true,
      "source": "composition_table"
    },
    {
      "id": "p002",
      "name": "蛋炒饭",
      "cat": "主食",
      "base": {
        "cal": 165,
        "per": 100,
        "unit": "g",
        "protein": 4.2,
        "carb": 22.5,
        "fat": 6.8
      },
      "pieceWeight": null,
      "vessel": "bowl_rice",
      "opts": [],
      "img": "staple/p002.webp",
      "conf": 2,
      "editable": true,
      "source": "recipe_estimate"
    },
    {
      "id": "p003",
      "name": "扬州炒饭",
      "cat": "主食",
      "base": {
        "cal": 172,
        "per": 100,
        "unit": "g",
        "protein": 5.1,
        "carb": 21.8,
        "fat": 7.5
      },
      "pieceWeight": null,
      "vessel": "bowl_rice",
      "opts": [],
      "img": "staple/p003.webp",
      "conf": 2,
      "editable": true,
      "source": "recipe_estimate"
    },
    {
      "id": "p004",
      "name": "咖喱饭",
      "cat": "主食",
      "base": {
        "cal": 148,
        "per": 100,
        "unit": "g",
        "protein": 4.8,
        "carb": 20.5,
        "fat": 5.2
      },
      "pieceWeight": null,
      "vessel": "bowl_rice",
      "opts": [],
      "img": "staple/p004.webp",
      "conf": 2,
      "editable": true,
      "source": "recipe_estimate"
    },
    {
      "id": "p005",
      "name": "盖浇饭",
      "cat": "主食",
      "base": {
        "cal": 142,
        "per": 100,
        "unit": "g",
        "protein": 5.5,
        "carb": 19.8,
        "fat": 4.8